{
  "$schema": "./template_metadata_schema.json",
  "id": "pattern_001",
  "numericId": 1,
  "version": "1.0.0",
  "name": "Ocean Wave",
  "category": "ambient",
  "description": "Gentle blue-green waves flowing across the strip with organic motion. Perfect for relaxation and calm environments.",
  "tags": ["calm", "blue", "water", "flowing", "ambient"],

  "thumbnailData": "data:image/png;base64,iVBORw0KGgoAAAANSUhEUgAAAAEAAAABCAYAAAAfFcSJAAAADUlEQVR42mNk+M9QDwADhgGAWjR9awAAAABJRU5ErkJggg==",

  "author": {
    "name": "PRISM Team",
    "url": "https://prism.k1"
  },

  "parameters": [
    {
      "name": "speed",
      "displayName": "Wave Speed",
      "type": "float",
      "min": 0.1,
      "max": 5.0,
      "default": 1.0,
      "step": 0.1,
      "description": "Controls how fast the waves propagate across the strip",
      "unit": "x"
    },
    {
      "name": "intensity",
      "displayName": "Wave Intensity",
      "type": "float",
      "min": 0.0,
      "max": 1.0,
      "default": 0.7,
      "step": 0.05,
      "description": "Wave amplitude and brightness variation"
    },
    {
      "name": "color_shift",
      "displayName": "Base Color",
      "type": "color",
      "default": 180,
      "description": "Hue center point (180=cyan, 200=blue)"
    },
    {
      "name": "wave_count",
      "displayName": "Wave Count",
      "type": "int",
      "min": 1,
      "max": 8,
      "default": 3,
      "description": "Number of simultaneous waves"
    },
    {
      "name": "depth",
      "displayName": "Color Depth",
      "type": "float",
      "min": 0.2,
      "max": 1.0,
      "default": 0.6,
      "step": 0.1,
      "description": "Amount of color variation in the waves"
    }
  ],

  "universalParameters": {
    "brightness": {
      "default": 1.0
    },
    "speed": {
      "default": 1.0
    },
    "scale": {
      "default": 1.0
    }
  },

  "performance": {
    "minFps": 30,
    "targetFps": 60,
    "updatePeriodMs": 16,
    "cycleTimeMs": 10000,
    "powerFactor": 0.35
  },

  "memory": {
    "compressedBytes": 8192,
    "runtimeBytes": 20480,
    "cpuPercent": 15
  },

  "firmwareVersion": "1.0.0",

  "ledCount": {
    "min": 30,
    "max": 1000,
    "recommended": 320
  },

  "features": {
    "supportsBlending": true,
    "supportsReverse": true,
    "supportsLooping": true,
    "requiresAudio": false
  },

  "metadata": {
    "createdAt": "2025-10-15T00:00:00Z",
    "updatedAt": "2025-10-15T00:00:00Z",
    "deprecated": false
  }
}
